{
 "languageVersion":1,"id":"armada-squadron-training","revision":"template",
 "modules":{"core":"1","space":"1","scenario":"1","dice":"1"},
 "limits":{"maxInstructions":20000,"maxCollectionSize":64,"maxCallDepth":8},
 "dice":{"blue":{"maxRerolls":0,"faces":[{"weight":4,"value":0,"symbols":["hit"]},{"weight":2,"value":0,"symbols":["critical"]},{"weight":2,"value":0,"symbols":["accuracy"]}]}},
 "resultTables":{"squadron":{"symbols":{"hit":1,"critical":0,"accuracy":0},"valueMultiplier":0,"unmapped":"ERROR"}},
 "state":{
  "names":{"type":{"list":"string"},"initial":["TIE Fighter Squadron","X-Wing Squadron"],"visibility":"PUBLIC"},
  "catalogueIds":{"type":{"list":"string"},"initial":["template-tie","template-xwing"],"visibility":"PUBLIC"},
  "factions":{"type":{"list":"string"},"initial":["Galactic Empire","Rebel Alliance"],"visibility":"PUBLIC"},
  "hulls":{"type":{"list":"integer"},"initial":[3,5],"visibility":"PUBLIC"},
  "speeds":{"type":{"list":"decimal"},"initial":[400,300],"visibility":"PUBLIC"},
  "pools":{"type":{"list":{"list":"string"}},"initial":[["blue","blue","blue"],["blue","blue","blue","blue"]],"visibility":"PUBLIC"},
  "startX":{"type":{"list":"decimal"},"initial":[200,800],"visibility":"PUBLIC"},
  "roundLimit":{"type":"integer","initial":6,"visibility":"PUBLIC"},
  "catalogueFingerprint":{"type":"string","initial":"unimported-template","visibility":"PUBLIC"}
 },
 "entities":{"squadron":{"ownership":"PLAYER","attributes":{
  "catalogueId":{"type":"string","initial":"","visibility":"PUBLIC"},"name":{"type":"string","initial":"","visibility":"PUBLIC"},"faction":{"type":"string","initial":"","visibility":"PUBLIC"},
  "x":{"type":"decimal","initial":0,"visibility":"PUBLIC"},"y":{"type":"decimal","initial":0,"visibility":"PUBLIC"},"heading":{"type":"decimal","initial":0,"visibility":"PUBLIC"},
  "placed":{"type":"boolean","initial":false,"visibility":"PUBLIC"},"alive":{"type":"boolean","initial":true,"visibility":"PUBLIC"},"opaque":{"type":"boolean","initial":false,"visibility":"PUBLIC"},
  "speed":{"type":"decimal","initial":0,"visibility":"PUBLIC"},"pool":{"type":{"list":"string"},"initial":[],"visibility":"PUBLIC"}
 },"resources":{"health":{"initial":0,"minimum":0,"maximum":100,"visibility":"PUBLIC"}}}},
 "space":{
  "boards":{"table":{"model":"CONTINUOUS","width":1000,"height":600,"unit":"development-unit","metric":"EUCLIDEAN","cornerCutting":false,"touchingAllowed":true,"tolerance":0.000001}},
  "bodies":{"squadron":{"board":"table","x":"x","y":"y","facing":"heading","placed":"placed","solid":"alive","opaque":"opaque","shape":"CIRCLE","radius":25,"width":0,"height":0}},
  "movements":{"fly":{"traversal":"DESTINATION","allowance":"speed","maximumTurn":180,"collisions":true,"ownerOnly":true}},
  "zones":{"deployment":{"board":"table","ownerSeat":-1,"x":0,"y":0,"width":1000,"height":600}}
 },
 "scenario":{"rosters":{},"damage":{"wounds":{"entityType":"squadron","health":"health","absorbers":[],"capAtRemaining":true,"onZero":"MARK","marker":"alive"}}},
 "events":{},"setup":"prepare",
 "procedures":{
  "prepare":{"parameters":{},"steps":[
   {"op":"scenario.require","args":{"condition":{"op":"eq","args":[{"op":"count","args":[{"var":"players"}]},2]},"code":"TWO_PLAYERS"}},
   {"op":"core.forEach","source":{"list":{"elementType":"integer","items":[0,1]}},"as":"seat","maxItems":2,"steps":[
    {"op":"core.let","name":"p","value":{"op":"at","args":[{"var":"players"},{"var":"seat"}]}},
    {"op":"core.createEntity","type":"squadron","id":{"op":"id","args":[{"var":"p"}]},"owner":{"var":"p"},"attributes":{
     "catalogueId":{"op":"at","args":[{"state":"catalogueIds"},{"var":"seat"}]},"name":{"op":"at","args":[{"state":"names"},{"var":"seat"}]},"faction":{"op":"at","args":[{"state":"factions"},{"var":"seat"}]},"speed":{"op":"at","args":[{"state":"speeds"},{"var":"seat"}]},"pool":{"op":"at","args":[{"state":"pools"},{"var":"seat"}]}},"resources":{"health":{"op":"at","args":[{"state":"hulls"},{"var":"seat"}]}},"as":"unit"},
    {"op":"space.deploy","args":{"entity":{"var":"unit"},"zone":"deployment","x":{"op":"at","args":[{"state":"startX"},{"var":"seat"}]},"y":300,"heading":0}}
   ]}
  ]},
  "move":{"parameters":{"entity":"entity:squadron","heading":"decimal","path":{"list":{"list":"decimal"}}},"steps":[{"op":"space.move","args":{"entity":{"var":"entity"},"policy":"fly","path":{"var":"path"},"heading":{"var":"heading"}}}]},
  "attack":{"parameters":{"actor":"player","entity":"entity:squadron","target":"entity:squadron"},"steps":[
   {"op":"dice.roll","args":{"owner":{"var":"actor"},"visibility":"PUBLIC","dice":{"get":{"entity":{"var":"entity"},"field":"pool"}}},"as":"roll"},
   {"op":"scenario.damage","args":{"target":{"var":"target"},"policy":"wounds","amount":{"query":{"op":"dice.resolve","args":{"roll":{"var":"roll"},"table":"squadron"}}}},"as":"damage"},
   {"op":"dice.close","args":{"roll":{"var":"roll"}}},{"op":"dice.clear","args":{"roll":{"var":"roll"}}},
   {"op":"core.if","condition":{"op":"not","args":[{"get":{"entity":{"var":"target"},"field":"alive"}}]},"then":[{"op":"core.endGame","outcome":"elimination","winners":{"list":{"elementType":"player","items":[{"var":"actor"}]}}}],"else":[]}
  ]},
  "score":{"parameters":{},"steps":[{"op":"core.if","condition":{"op":"gte","args":[{"var":"round"},{"state":"roundLimit"}]},"then":[{"op":"core.endGame","outcome":"round-limit-draw","winners":{"list":{"elementType":"player","items":[]}}}],"else":[]}]}
 },
 "actions":{
  "move":{"parameters":{"entity":"entity:squadron","heading":"decimal","path":{"list":{"list":"decimal"}}},"availableWhen":{"op":"eq","args":[{"op":"count","args":[{"filter":{"source":{"entities":"squadron"},"as":"other","where":{"op":"and","args":[{"op":"ne","args":[{"owner":{"var":"other"}},{"var":"actor"}]},{"get":{"entity":{"var":"other"},"field":"alive"}},{"op":"lte","args":[{"query":{"op":"space.distance","args":{"from":{"var":"entity"},"to":{"var":"other"},"mode":"EDGES"}}},100]}]}}}]},0]},"procedure":"move","args":{"entity":{"var":"entity"},"heading":{"var":"heading"},"path":{"var":"path"}},"preview":"MOVEMENT","priority":10,"choices":{
   "entity":{"entities":"squadron"},"heading":{"list":{"elementType":"decimal","items":[0]}},"path":{"query":{"op":"space.paths","args":{"entity":{"var":"entity"},"policy":"fly","targets":{"filter":{"source":{"entities":"squadron"},"as":"e","where":{"op":"ne","args":[{"owner":{"var":"e"}},{"var":"actor"}]}}}}}}
  }},
  "attack":{"parameters":{"entity":"entity:squadron","target":"entity:squadron"},"availableWhen":{"op":"and","args":[{"op":"eq","args":[{"owner":{"var":"entity"}},{"var":"actor"}]},{"op":"ne","args":[{"owner":{"var":"target"}},{"var":"actor"}]},{"get":{"entity":{"var":"target"},"field":"alive"}},{"op":"lte","args":[{"query":{"op":"space.distance","args":{"from":{"var":"entity"},"to":{"var":"target"},"mode":"EDGES"}}},100]},{"query":{"op":"space.lineOfSight","args":{"from":{"var":"entity"},"to":{"var":"target"}}}}]},"procedure":"attack","args":{"actor":{"var":"actor"},"entity":{"var":"entity"},"target":{"var":"target"}},"priority":20,"choices":{"entity":{"entities":"squadron"},"target":{"entities":"squadron"}}}
 },
 "flow":{"initial":"squadrons","roundStart":"squadrons","phases":{
  "squadrons":{"controller":"ALTERNATING_ENTITIES","groupSize":1,"entityParameter":"entity","entities":{"filter":{"source":{"entities":"squadron"},"as":"e","where":{"op":"and","args":[{"op":"eq","args":[{"owner":{"var":"e"}},{"var":"actor"}]},{"get":{"entity":{"var":"e"},"field":"alive"}}]}}},"steps":[{"id":"act","actions":["move","attack"],"minimum":0,"maximum":1}],"next":"scoring"},
  "scoring":{"controller":"AUTOMATIC","groupSize":1,"onEnter":"score","steps":[],"next":"squadrons"}
 }}
}
