{
 "languageVersion":1,"id":"vector-orders","revision":"1",
 "modules":{"core":"1","space":"1","scenario":"1","dice":"1","queues":"1","resources":"1"},
 "limits":{"maxInstructions":20000,"maxCollectionSize":64,"maxCallDepth":8,"maxWindowDepth":4},
 "dice":{"beam":{"maxRerolls":0,"faces":[{"weight":2,"value":0,"symbols":["hit"]},{"weight":1,"value":0,"symbols":["critical"]}]}},
 "resultTables":{"wounds":{"symbols":{"hit":1,"critical":2},"valueMultiplier":0,"unmapped":"ERROR"}},
 "state":{"orders":{"type":{"list":"string"},"initial":["focus"],"visibility":"PUBLIC"},"damage":{"type":"integer","initial":0,"visibility":"PUBLIC"},"roundLimit":{"type":"integer","initial":10,"visibility":"PUBLIC"}},
 "entities":{"ship":{"ownership":"PLAYER","attributes":{
  "x":{"type":"decimal","initial":0,"visibility":"PUBLIC"},"y":{"type":"decimal","initial":0,"visibility":"PUBLIC"},"heading":{"type":"decimal","initial":0,"visibility":"PUBLIC"},
  "placed":{"type":"boolean","initial":false,"visibility":"PUBLIC"},"alive":{"type":"boolean","initial":true,"visibility":"PUBLIC"},"opaque":{"type":"boolean","initial":false,"visibility":"PUBLIC"},
  "speed":{"type":"decimal","initial":3,"visibility":"PUBLIC"},"points":{"type":"integer","initial":10,"visibility":"PUBLIC"},"orders":{"type":{"list":"string"},"initial":[],"visibility":"OWNER"}
 },"resources":{"health":{"initial":4,"minimum":0,"maximum":4,"visibility":"PUBLIC"},"shield":{"initial":1,"minimum":0,"maximum":1,"visibility":"PUBLIC"},"guard":{"initial":1,"minimum":0,"maximum":1,"visibility":"PUBLIC"}}}},
 "space":{
  "boards":{"table":{"model":"CONTINUOUS","width":12,"height":10,"unit":"cm","metric":"EUCLIDEAN","cornerCutting":false,"touchingAllowed":true,"tolerance":0.000001}},
  "bodies":{"ship":{"board":"table","x":"x","y":"y","facing":"heading","placed":"placed","solid":"alive","opaque":"opaque","shape":"CIRCLE","radius":0.5,"width":0,"height":0}},
  "movements":{"sail":{"traversal":"SWEPT","allowance":"speed","maximumTurn":180,"collisions":true,"ownerOnly":true}},
  "zones":{"west":{"board":"table","ownerSeat":0,"x":0,"y":0,"width":3,"height":10},"east":{"board":"table","ownerSeat":1,"x":9,"y":0,"width":3,"height":10}}
 },
 "scenario":{"rosters":{"fleet":{"entityType":"ship","points":"points","budget":10,"minimum":1,"maximum":1,"unique":"","faction":"","factions":[]}},"damage":{"hull":{"entityType":"ship","health":"health","absorbers":["shield"],"capAtRemaining":true,"onZero":"MARK","marker":"alive"}}},
 "events":{},"setup":"prepare",
 "procedures":{
  "prepare":{"parameters":{},"steps":[
   {"op":"scenario.require","args":{"condition":{"op":"eq","args":[{"op":"count","args":[{"var":"players"}]},2]},"code":"TWO_PLAYERS"}},
   {"op":"core.forEach","source":{"var":"players"},"as":"p","maxItems":2,"steps":[
    {"op":"core.createEntity","type":"ship","id":{"op":"id","args":[{"var":"p"}]},"owner":{"var":"p"},"attributes":{},"resources":{},"as":"ship"},
    {"op":"core.if","condition":{"op":"eq","args":[{"var":"p"},{"op":"at","args":[{"var":"players"},0]}]},"then":[{"op":"space.deploy","args":{"entity":{"var":"ship"},"zone":"west","x":2,"y":5,"heading":0}}],"else":[{"op":"space.deploy","args":{"entity":{"var":"ship"},"zone":"east","x":10,"y":5,"heading":0}}]},
    {"op":"scenario.roster","args":{"owner":{"var":"p"},"entities":{"list":{"elementType":"entity:ship","items":[{"var":"ship"}]}},"policy":"fleet"}}
   ]}
  ]},
  "plan":{"parameters":{"entity":"entity:ship","orders":{"list":"string"}},"steps":[{"op":"queues.plan","args":{"entity":{"var":"entity"},"field":"orders","capacity":1,"orders":{"var":"orders"},"allowed":{"state":"orders"}}},{"op":"queues.commit","args":{"entity":{"var":"entity"},"field":"orders"}}]},
  "move":{"parameters":{"entity":"entity:ship","heading":"decimal","path":{"list":{"list":"decimal"}}},"steps":[{"op":"space.move","args":{"entity":{"var":"entity"},"policy":"sail","path":{"var":"path"},"heading":{"var":"heading"}}}]},
  "attack":{"parameters":{"actor":"player","entity":"entity:ship","target":"entity:ship"},"steps":[
   {"op":"queues.reveal","args":{"entity":{"var":"entity"},"field":"orders"},"as":"order"},
   {"op":"dice.roll","args":{"owner":{"var":"actor"},"visibility":"PUBLIC","dice":{"list":{"elementType":"string","items":["beam"]}}},"as":"roll"},
   {"op":"core.if","condition":{"op":"eq","args":[{"var":"order"},"focus"]},"then":[{"op":"dice.add","args":{"roll":{"var":"roll"},"dice":{"list":{"elementType":"string","items":["beam"]}}}}],"else":[]},
   {"op":"core.setState","field":"damage","value":{"query":{"op":"dice.resolve","args":{"roll":{"var":"roll"},"table":"wounds"}}}},
   {"op":"core.window","window":"defend","args":{"target":{"var":"target"}}},
   {"op":"scenario.damage","args":{"target":{"var":"target"},"policy":"hull","amount":{"state":"damage"}},"as":"dealt"},
   {"op":"dice.close","args":{"roll":{"var":"roll"}}},{"op":"dice.clear","args":{"roll":{"var":"roll"}}},
   {"op":"core.call","procedure":"score","args":{}}
  ]},
  "guard":{"parameters":{"target":"entity:ship"},"steps":[{"op":"core.modifyResource","entity":{"var":"target"},"resource":"guard","delta":-1},{"op":"core.setState","field":"damage","value":{"op":"ceil","args":[{"op":"div","args":[{"state":"damage"},2]}]}}]},
  "score":{"parameters":{},"steps":[
   {"op":"core.let","name":"survivors","value":{"filter":{"source":{"var":"players"},"as":"p","where":{"op":"gt","args":[{"op":"count","args":[{"filter":{"source":{"entities":"ship"},"as":"e","where":{"op":"and","args":[{"op":"eq","args":[{"owner":{"var":"e"}},{"var":"p"}]},{"get":{"entity":{"var":"e"},"field":"alive"}}]}}}]},0]}}}},
   {"op":"core.if","condition":{"op":"lte","args":[{"op":"count","args":[{"var":"survivors"}]},1]},"then":[{"op":"core.endGame","outcome":"elimination","winners":{"var":"survivors"}}],"else":[{"op":"core.if","condition":{"op":"gte","args":[{"var":"round"},{"state":"roundLimit"}]},"then":[{"op":"core.endGame","outcome":"draw","winners":{"list":{"elementType":"player","items":[]}}}],"else":[]}]}
  ]}
 },
 "windows":{"defend":{"parameters":{"target":"entity:ship"},"responders":{"list":{"elementType":"player","items":[{"owner":{"var":"target"}}]}},"maxResponders":1,"allowPass":true,"visibility":"OWNER","choices":[{"id":"guard","when":{"op":"gt","args":[{"resource":{"entity":{"var":"target"},"field":"guard"}},0]},"procedure":"guard","args":{"target":{"var":"target"}}}]}},
 "actions":{
  "plan":{"parameters":{"entity":"entity:ship","orders":{"list":"string"}},"availableWhen":{"op":"and","args":[{"op":"eq","args":[{"owner":{"var":"entity"}},{"var":"actor"}]},{"op":"eq","args":[{"op":"count","args":[{"var":"orders"}]},{"op":"sub","args":[1,{"op":"count","args":[{"get":{"entity":{"var":"entity"},"field":"orders"}}]}]}]}]},"procedure":"plan","args":{"entity":{"var":"entity"},"orders":{"var":"orders"}},"choices":{"entity":{"filter":{"source":{"entities":"ship"},"as":"e","where":{"op":"eq","args":[{"owner":{"var":"e"}},{"var":"actor"}]}}},"orders":{"list":{"elementType":{"list":"string"},"items":[{"state":"orders"},{"list":{"elementType":"string","items":[]}}]}}}},
  "move":{"parameters":{"entity":"entity:ship","heading":"decimal","path":{"list":{"list":"decimal"}}},"availableWhen":{"get":{"entity":{"var":"entity"},"field":"alive"}},"procedure":"move","args":{"entity":{"var":"entity"},"heading":{"var":"heading"},"path":{"var":"path"}},"preview":"MOVEMENT","priority":10,"choices":{
   "entity":{"entities":"ship"},"heading":{"list":{"elementType":"decimal","items":[0]}},"path":{"query":{"op":"space.paths","args":{"entity":{"var":"entity"},"policy":"sail","targets":{"filter":{"source":{"entities":"ship"},"as":"e","where":{"op":"ne","args":[{"owner":{"var":"e"}},{"var":"actor"}]}}}}}}
  }},
  "attack":{"parameters":{"entity":"entity:ship","target":"entity:ship"},"availableWhen":{"op":"and","args":[{"op":"eq","args":[{"owner":{"var":"entity"}},{"var":"actor"}]},{"op":"ne","args":[{"owner":{"var":"target"}},{"var":"actor"}]},{"get":{"entity":{"var":"target"},"field":"alive"}},{"op":"lte","args":[{"query":{"op":"space.distance","args":{"from":{"var":"entity"},"to":{"var":"target"},"mode":"EDGES"}}},3]},{"query":{"op":"space.inArc","args":{"from":{"var":"entity"},"to":{"var":"target"},"start":0,"sweep":360}}},{"query":{"op":"space.lineOfSight","args":{"from":{"var":"entity"},"to":{"var":"target"}}}}]},"procedure":"attack","args":{"actor":{"var":"actor"},"entity":{"var":"entity"},"target":{"var":"target"}},"priority":20,"choices":{"entity":{"entities":"ship"},"target":{"entities":"ship"}}}
 },
 "flow":{"initial":"planning","roundStart":"planning","phases":{
  "planning":{"controller":"SIMULTANEOUS","groupSize":1,"steps":[{"id":"plan","actions":["plan"],"minimum":1,"maximum":1}],"next":"battle"},
  "battle":{"controller":"ALTERNATING_ENTITIES","groupSize":1,"entityParameter":"entity","entities":{"filter":{"source":{"entities":"ship"},"as":"e","where":{"op":"and","args":[{"op":"eq","args":[{"owner":{"var":"e"}},{"var":"actor"}]},{"get":{"entity":{"var":"e"},"field":"alive"}}]}}},"steps":[{"id":"move","actions":["move"],"minimum":0,"maximum":1},{"id":"attack","actions":["attack"],"minimum":0,"maximum":1}],"next":"scoring"},
  "scoring":{"controller":"AUTOMATIC","groupSize":1,"onEnter":"score","steps":[],"next":"planning"}
 }}
}
