{
 "languageVersion":1,"id":"grid-skirmish","revision":"1",
 "modules":{"core":"1","space":"1","scenario":"1"},
 "limits":{"maxInstructions":20000,"maxCollectionSize":64,"maxCallDepth":8,"maxWindowDepth":4},
 "state":{"damage":{"type":"integer","initial":0,"visibility":"PUBLIC"},"roundLimit":{"type":"integer","initial":8,"visibility":"PUBLIC"}},
 "entities":{"piece":{"ownership":"PLAYER","attributes":{
  "x":{"type":"integer","initial":0,"visibility":"PUBLIC"},"y":{"type":"integer","initial":0,"visibility":"PUBLIC"},
  "heading":{"type":"decimal","initial":0,"visibility":"PUBLIC"},"placed":{"type":"boolean","initial":false,"visibility":"PUBLIC"},
  "alive":{"type":"boolean","initial":true,"visibility":"PUBLIC"},"opaque":{"type":"boolean","initial":false,"visibility":"PUBLIC"},
  "speed":{"type":"integer","initial":2,"visibility":"PUBLIC"},"points":{"type":"integer","initial":5,"visibility":"PUBLIC"}
 },"resources":{"health":{"initial":3,"minimum":0,"maximum":3,"visibility":"PUBLIC"},"guard":{"initial":1,"minimum":0,"maximum":1,"visibility":"PUBLIC"}}}},
 "space":{
  "boards":{"table":{"model":"GRID","width":9,"height":5,"unit":"cell","metric":"MANHATTAN","cornerCutting":false,"touchingAllowed":true,"tolerance":0.000001}},
  "bodies":{"piece":{"board":"table","x":"x","y":"y","facing":"heading","placed":"placed","solid":"alive","opaque":"opaque","shape":"POINT","radius":0,"width":0,"height":0}},
  "movements":{"walk":{"traversal":"SWEPT","allowance":"speed","maximumTurn":180,"collisions":true,"ownerOnly":true}},
  "zones":{"west":{"board":"table","ownerSeat":0,"x":0,"y":0,"width":2,"height":5},"east":{"board":"table","ownerSeat":1,"x":7,"y":0,"width":2,"height":5},"objective":{"board":"table","ownerSeat":-1,"x":3,"y":0,"width":3,"height":5}}
 },
 "scenario":{"rosters":{"squad":{"entityType":"piece","points":"points","budget":10,"minimum":2,"maximum":2,"unique":"","faction":"","factions":[]}},"damage":{"wounds":{"entityType":"piece","health":"health","absorbers":[],"capAtRemaining":true,"onZero":"MARK","marker":"alive"}}},
 "events":{"score":{"visibility":"PUBLIC","fields":{"player":"player","value":"integer"}}},"setup":"prepare",
 "procedures":{
  "prepare":{"parameters":{},"steps":[
   {"op":"scenario.require","args":{"condition":{"op":"eq","args":[{"op":"count","args":[{"var":"players"}]},2]},"code":"TWO_PLAYERS"}},
   {"op":"core.forEach","source":{"var":"players"},"as":"p","maxItems":2,"steps":[
    {"op":"core.call","procedure":"spawn","args":{"p":{"var":"p"},"suffix":"a","y":1}},
    {"op":"core.call","procedure":"spawn","args":{"p":{"var":"p"},"suffix":"b","y":3}},
    {"op":"scenario.roster","args":{"owner":{"var":"p"},"entities":{"filter":{"source":{"entities":"piece"},"as":"e","where":{"op":"eq","args":[{"owner":{"var":"e"}},{"var":"p"}]}}},"policy":"squad"}}
   ]}
  ]},
  "spawn":{"parameters":{"p":"player","suffix":"string","y":"integer"},"steps":[
   {"op":"core.createEntity","type":"piece","id":{"op":"concat","args":[{"op":"id","args":[{"var":"p"}]},"-",{"var":"suffix"}]},"owner":{"var":"p"},"attributes":{},"resources":{},"as":"piece"},
   {"op":"core.if","condition":{"op":"eq","args":[{"var":"p"},{"op":"at","args":[{"var":"players"},0]}]},"then":[{"op":"space.deploy","args":{"entity":{"var":"piece"},"zone":"west","x":1,"y":{"var":"y"},"heading":0}}],"else":[{"op":"space.deploy","args":{"entity":{"var":"piece"},"zone":"east","x":7,"y":{"var":"y"},"heading":0}}]}
  ]},
  "move":{"parameters":{"entity":"entity:piece","heading":"decimal","path":{"list":{"list":"decimal"}}},"steps":[{"op":"space.move","args":{"entity":{"var":"entity"},"policy":"walk","path":{"var":"path"},"heading":{"var":"heading"}}}]},
  "attack":{"parameters":{"actor":"player","target":"entity:piece"},"steps":[
   {"op":"core.setState","field":"damage","value":2},
   {"op":"core.window","window":"defend","args":{"target":{"var":"target"}}},
   {"op":"scenario.damage","args":{"target":{"var":"target"},"policy":"wounds","amount":{"state":"damage"}},"as":"dealt"},
   {"op":"core.call","procedure":"score","args":{}}
  ]},
  "guard":{"parameters":{"target":"entity:piece"},"steps":[{"op":"core.modifyResource","entity":{"var":"target"},"resource":"guard","delta":-1},{"op":"core.setState","field":"damage","value":{"op":"sub","args":[{"state":"damage"},1]}}]},
  "score":{"parameters":{},"steps":[
   {"op":"core.let","name":"survivors","value":{"filter":{"source":{"var":"players"},"as":"p","where":{"op":"gt","args":[{"op":"count","args":[{"filter":{"source":{"entities":"piece"},"as":"e","where":{"op":"and","args":[{"op":"eq","args":[{"owner":{"var":"e"}},{"var":"p"}]},{"get":{"entity":{"var":"e"},"field":"alive"}}]}}}]},0]}}}},
   {"op":"core.if","condition":{"op":"lte","args":[{"op":"count","args":[{"var":"survivors"}]},1]},"then":[{"op":"core.endGame","outcome":"elimination","winners":{"var":"survivors"}}],"else":[
    {"op":"core.if","condition":{"op":"gte","args":[{"var":"round"},{"state":"roundLimit"}]},"then":[
     {"op":"core.let","name":"scores","value":{"map":{"source":{"var":"players"},"as":"p","value":{"op":"count","args":[{"filter":{"source":{"entities":"piece"},"as":"e","where":{"op":"and","args":[{"op":"eq","args":[{"owner":{"var":"e"}},{"var":"p"}]},{"get":{"entity":{"var":"e"},"field":"alive"}},{"query":{"op":"space.inZone","args":{"entity":{"var":"e"},"zone":"objective"}}}]}}}]}}}},
     {"op":"core.forEach","source":{"var":"players"},"as":"p","maxItems":2,"steps":[{"op":"core.emit","event":"score","values":{"player":{"var":"p"},"value":{"op":"count","args":[{"filter":{"source":{"entities":"piece"},"as":"e","where":{"op":"and","args":[{"op":"eq","args":[{"owner":{"var":"e"}},{"var":"p"}]},{"get":{"entity":{"var":"e"},"field":"alive"}},{"query":{"op":"space.inZone","args":{"entity":{"var":"e"},"zone":"objective"}}}]}}}]}}}]},
     {"op":"core.endGame","outcome":"objective","winners":{"filter":{"source":{"var":"players"},"as":"p","where":{"op":"gte","args":[{"op":"mul","args":[2,{"op":"count","args":[{"filter":{"source":{"entities":"piece"},"as":"e","where":{"op":"and","args":[{"op":"eq","args":[{"owner":{"var":"e"}},{"var":"p"}]},{"get":{"entity":{"var":"e"},"field":"alive"}},{"query":{"op":"space.inZone","args":{"entity":{"var":"e"},"zone":"objective"}}}]}}}]}]},{"op":"sum","args":[{"var":"scores"}]}]}}}}
    ],"else":[]}
   ]}
  ]}
 },
 "windows":{"defend":{"parameters":{"target":"entity:piece"},"responders":{"list":{"elementType":"player","items":[{"owner":{"var":"target"}}]}},"maxResponders":1,"allowPass":true,"visibility":"OWNER","choices":[{"id":"guard","when":{"op":"gt","args":[{"resource":{"entity":{"var":"target"},"field":"guard"}},0]},"procedure":"guard","args":{"target":{"var":"target"}}}]}},
 "actions":{
  "move":{"parameters":{"entity":"entity:piece","heading":"decimal","path":{"list":{"list":"decimal"}}},"availableWhen":{"get":{"entity":{"var":"entity"},"field":"alive"}},"procedure":"move","args":{"entity":{"var":"entity"},"heading":{"var":"heading"},"path":{"var":"path"}},"preview":"MOVEMENT","priority":10,"choices":{
   "entity":{"entities":"piece"},"heading":{"list":{"elementType":"decimal","items":[0]}},"path":{"query":{"op":"space.paths","args":{"entity":{"var":"entity"},"policy":"walk","targets":{"filter":{"source":{"entities":"piece"},"as":"e","where":{"op":"and","args":[{"op":"ne","args":[{"owner":{"var":"e"}},{"var":"actor"}]},{"get":{"entity":{"var":"e"},"field":"alive"}}]}}}}}}
  }},
  "attack":{"parameters":{"entity":"entity:piece","target":"entity:piece"},"availableWhen":{"op":"and","args":[{"op":"eq","args":[{"owner":{"var":"entity"}},{"var":"actor"}]},{"op":"ne","args":[{"owner":{"var":"target"}},{"var":"actor"}]},{"get":{"entity":{"var":"target"},"field":"alive"}},{"op":"lte","args":[{"query":{"op":"space.distance","args":{"from":{"var":"entity"},"to":{"var":"target"},"mode":"BOARD"}}},2]},{"query":{"op":"space.lineOfSight","args":{"from":{"var":"entity"},"to":{"var":"target"}}}}]},"procedure":"attack","args":{"actor":{"var":"actor"},"target":{"var":"target"}},"priority":20,"choices":{"entity":{"entities":"piece"},"target":{"entities":"piece"}}}
 },
 "flow":{"initial":"battle","roundStart":"battle","phases":{
  "battle":{"controller":"PLAYER_PHASE","groupSize":1,"entityParameter":"entity","entities":{"filter":{"source":{"entities":"piece"},"as":"e","where":{"op":"and","args":[{"op":"eq","args":[{"owner":{"var":"e"}},{"var":"actor"}]},{"get":{"entity":{"var":"e"},"field":"alive"}}]}}},"steps":[{"id":"move","actions":["move"],"minimum":0,"maximum":1},{"id":"attack","actions":["attack"],"minimum":0,"maximum":1}],"next":"scoring"},
  "scoring":{"controller":"AUTOMATIC","groupSize":1,"onEnter":"score","steps":[],"next":"battle"}
 }}
}
